SQL> -- Set the page size.
SQL> SET ECHO ON
SQL> SET PAGESIZE 999
SQL> -- ----------------------------------------------------------------------
SQL> -- Step #0 : CALL updated preseed script that has _lab corrections in it
SQL> -- ----------------------------------------------------------------------
SQL> SELECT 'Step #0 Call updated preseed script that has _lab corrections in it'
  2  AS "Step Number" FROM dual;

Step Number                                                                     
-------------------------------------------------------------------             
Step #0 Call updated preseed script that has _lab corrections in it             

1 row selected.

SQL> 
SQL> -- ----------------------------------------------------------------------
SQL> -- Objective #1: Setup preseed for _LAB tables
SQL> -- ----------------------------------------------------------------------
SQL> @/home/student/Data/cit225/oracle/lab3/preseed_oracle_store_lab_tables.sql
SQL> -- ------------------------------------------------------------------
SQL> --  Program Name:	 preseed_oracle_store_lab_tables.sql
SQL> --  Lab Assignment: N/A
SQL> --  Program Author: Michael McLaughlin
SQL> --  Creation Date:  20-may-2018
SQL> -- ------------------------------------------------------------------
SQL> --  Change Log:
SQL> -- ------------------------------------------------------------------
SQL> --  Change Date	Change Reason
SQL> -- -------------  ---------------------------------------------------
SQL> --
SQL> -- ------------------------------------------------------------------
SQL> -- This creates tables, sequences, indexes, and constraints necessary
SQL> -- to begin lesson #3. Demonstrates proper process and syntax.
SQL> -- ------------------------------------------------------------------
SQL> 
SQL> -- --------------------------------------------------------
SQL> --  Step #1
SQL> --  -------
SQL> --  Disable foreign key constraints dependencies.
SQL> -- --------------------------------------------------------
SQL> ALTER TABLE system_user_lab
  2    DISABLE CONSTRAINT fk_system_user_lab_3;

Table altered.

SQL> 
SQL> ALTER TABLE system_user_lab
  2    DISABLE CONSTRAINT fk_system_user_lab_4;

Table altered.

SQL> 
SQL> COL table_name	  FORMAT A14  HEADING "Table Name"
SQL> COL constraint_name  FORMAT A24  HEADING "Constraint Name"
SQL> COL constraint_type  FORMAT A12  HEADING "Constraint Type"
SQL> COL status 	  FORMAT A8   HEADING "Status"
SQL> SELECT   table_name
  2  ,	      constraint_name
  3  ,	      CASE
  4  		WHEN constraint_type = 'R'	  THEN 'FOREIGN KEY'
  5  		WHEN constraint_type = 'P'	  THEN 'PRIMARY KEY'
  6  		WHEN constraint_type = 'U'	  THEN 'UNIQUE'
  7  		WHEN constraint_type = 'C' AND	REGEXP_LIKE(constraint_name,'^.*nn.*$','i')
  8  		THEN 'NOT NULL'
  9  		ELSE 'CHECK'
 10  	      END constraint_type
 11  ,	      status
 12  FROM     user_constraints
 13  WHERE    table_name = 'SYSTEM_USER_LAB'
 14  ORDER BY CASE
 15  		WHEN constraint_type = 'PRIMARY KEY' THEN 1
 16  		WHEN constraint_type = 'NOT NULL'    THEN 2
 17  		WHEN constraint_type = 'CHECK'	     THEN 3
 18  		WHEN constraint_type = 'UNIQUE'      THEN 4
 19  		WHEN constraint_type = 'FOREIGN KEY' THEN 5
 20  	      END
 21  ,	      constraint_name;

Table Name     Constraint Name          Constraint T Status                     
-------------- ------------------------ ------------ --------                   
SYSTEM_USER_LA PK_SYSTEM_USER_LAB_1     PRIMARY KEY  ENABLED                    
B                                                                               
                                                                                
SYSTEM_USER_LA NN_SYSTEM_USER_LAB_1     NOT NULL     ENABLED                    
B                                                                               
                                                                                
SYSTEM_USER_LA NN_SYSTEM_USER_LAB_2     NOT NULL     ENABLED                    
B                                                                               
                                                                                
SYSTEM_USER_LA NN_SYSTEM_USER_LAB_3     NOT NULL     ENABLED                    
B                                                                               
                                                                                
SYSTEM_USER_LA NN_SYSTEM_USER_LAB_4     NOT NULL     ENABLED                    
B                                                                               
                                                                                
SYSTEM_USER_LA NN_SYSTEM_USER_LAB_5     NOT NULL     ENABLED                    
B                                                                               
                                                                                
SYSTEM_USER_LA NN_SYSTEM_USER_LAB_6     NOT NULL     ENABLED                    
B                                                                               
                                                                                
SYSTEM_USER_LA NN_SYSTEM_USER_LAB_7     NOT NULL     ENABLED                    
B                                                                               
                                                                                
SYSTEM_USER_LA FK_SYSTEM_USER_LAB_1     FOREIGN KEY  ENABLED                    
B                                                                               
                                                                                
SYSTEM_USER_LA FK_SYSTEM_USER_LAB_2     FOREIGN KEY  ENABLED                    
B                                                                               
                                                                                
SYSTEM_USER_LA FK_SYSTEM_USER_LAB_3     FOREIGN KEY  DISABLED                   
B                                                                               
                                                                                
SYSTEM_USER_LA FK_SYSTEM_USER_LAB_4     FOREIGN KEY  DISABLED                   
B                                                                               
                                                                                

12 rows selected.

SQL> 
SQL> -- --------------------------------------------------------
SQL> --  Step #2
SQL> --  -------
SQL> --  Alter the table to remove not null constraints.
SQL> -- --------------------------------------------------------
SQL> ALTER TABLE system_user_lab
  2    MODIFY (system_user_lab_group_id  NUMBER  NULL);

Table altered.

SQL> 
SQL> ALTER TABLE system_user_lab
  2    MODIFY (system_user_lab_type  NUMBER  NULL);

Table altered.

SQL> 
SQL> COL table_name	  FORMAT A14  HEADING "Table Name"
SQL> COL constraint_name  FORMAT A24  HEADING "Constraint Name"
SQL> COL constraint_type  FORMAT A12  HEADING "Constraint Type"
SQL> COL status 	  FORMAT A8   HEADING "Status"
SQL> SELECT   table_name
  2  ,	      constraint_name
  3  ,	      CASE
  4  		WHEN constraint_type = 'R'	  THEN 'FOREIGN KEY'
  5  		WHEN constraint_type = 'P'	  THEN 'PRIMARY KEY'
  6  		WHEN constraint_type = 'U'	  THEN 'UNIQUE'
  7  		WHEN constraint_type = 'C' AND	REGEXP_LIKE(constraint_name,'^.*nn.*$','i')
  8  		THEN 'NOT NULL'
  9  		ELSE 'CHECK'
 10  	      END constraint_type
 11  ,	      status
 12  FROM     user_constraints
 13  WHERE    table_name = 'SYSTEM_USER_LAB'
 14  ORDER BY CASE
 15  		WHEN constraint_type = 'PRIMARY KEY' THEN 1
 16  		WHEN constraint_type = 'NOT NULL'    THEN 2
 17  		WHEN constraint_type = 'CHECK'	     THEN 3
 18  		WHEN constraint_type = 'UNIQUE'      THEN 4
 19  		WHEN constraint_type = 'FOREIGN KEY' THEN 5
 20  	      END
 21  ,	      constraint_name;

Table Name     Constraint Name          Constraint T Status                     
-------------- ------------------------ ------------ --------                   
SYSTEM_USER_LA PK_SYSTEM_USER_LAB_1     PRIMARY KEY  ENABLED                    
B                                                                               
                                                                                
SYSTEM_USER_LA NN_SYSTEM_USER_LAB_1     NOT NULL     ENABLED                    
B                                                                               
                                                                                
SYSTEM_USER_LA NN_SYSTEM_USER_LAB_4     NOT NULL     ENABLED                    
B                                                                               
                                                                                
SYSTEM_USER_LA NN_SYSTEM_USER_LAB_5     NOT NULL     ENABLED                    
B                                                                               
                                                                                
SYSTEM_USER_LA NN_SYSTEM_USER_LAB_6     NOT NULL     ENABLED                    
B                                                                               
                                                                                
SYSTEM_USER_LA NN_SYSTEM_USER_LAB_7     NOT NULL     ENABLED                    
B                                                                               
                                                                                
SYSTEM_USER_LA FK_SYSTEM_USER_LAB_1     FOREIGN KEY  ENABLED                    
B                                                                               
                                                                                
SYSTEM_USER_LA FK_SYSTEM_USER_LAB_2     FOREIGN KEY  ENABLED                    
B                                                                               
                                                                                
SYSTEM_USER_LA FK_SYSTEM_USER_LAB_3     FOREIGN KEY  DISABLED                   
B                                                                               
                                                                                
SYSTEM_USER_LA FK_SYSTEM_USER_LAB_4     FOREIGN KEY  DISABLED                   
B                                                                               
                                                                                

10 rows selected.

SQL> 
SQL> -- --------------------------------------------------------
SQL> --  Step #3
SQL> --  -------
SQL> --  Insert partial data set for preseeded system_user_lab.
SQL> -- --------------------------------------------------------
SQL> INSERT INTO system_user_lab
  2  ( system_user_lab_id
  3  , system_user_lab_name
  4  , system_user_lab_group_id
  5  , system_user_lab_type
  6  , created_by
  7  , creation_date
  8  , last_updated_by
  9  , last_update_date)
 10  VALUES
 11  ( 1	    -- system_user_lab_id
 12  ,'SYSADMIN'    -- system_user_lab_name
 13  , null	    -- system_user_lab_group_id
 14  , null	    -- system_user_lab_type
 15  , 1	    -- created_by
 16  , SYSDATE	    -- creation_date
 17  , 1	    -- last_updated_by
 18  , SYSDATE	    -- last_update_date
 19  );

1 row created.

SQL> 
SQL> -- --------------------------------------------------------
SQL> --  Step #4
SQL> --  -------
SQL> --  Disable foreign key constraints dependencies.
SQL> -- --------------------------------------------------------
SQL> ALTER TABLE common_lookup_lab
  2    DISABLE CONSTRAINT fk_clookup_lab_1;

Table altered.

SQL> 
SQL> ALTER TABLE common_lookup_lab
  2    DISABLE CONSTRAINT fk_clookup_lab_2;

Table altered.

SQL> 
SQL> COL table_name	  FORMAT A14  HEADING "Table Name"
SQL> COL constraint_name  FORMAT A24  HEADING "Constraint Name"
SQL> COL constraint_type  FORMAT A12  HEADING "Constraint Type"
SQL> COL status 	  FORMAT A8   HEADING "Status"
SQL> SELECT   table_name
  2  ,	      constraint_name
  3  ,	      CASE
  4  		WHEN constraint_type = 'R'	  THEN 'FOREIGN KEY'
  5  		WHEN constraint_type = 'P'	  THEN 'PRIMARY KEY'
  6  		WHEN constraint_type = 'U'	  THEN 'UNIQUE'
  7  		WHEN constraint_type = 'C' AND	REGEXP_LIKE(constraint_name,'^.*nn.*$','i')
  8  		THEN 'NOT NULL'
  9  		ELSE 'CHECK'
 10  	      END constraint_type
 11  ,	      status
 12  FROM     user_constraints
 13  WHERE    table_name = 'COMMON_LOOKUP_LAB'
 14  ORDER BY CASE
 15  		WHEN constraint_type = 'PRIMARY KEY' THEN 1
 16  		WHEN constraint_type = 'NOT NULL'    THEN 2
 17  		WHEN constraint_type = 'CHECK'	     THEN 3
 18  		WHEN constraint_type = 'UNIQUE'      THEN 4
 19  		WHEN constraint_type = 'FOREIGN KEY' THEN 5
 20  	      END
 21  ,	      constraint_name;

Table Name     Constraint Name          Constraint T Status                     
-------------- ------------------------ ------------ --------                   
COMMON_LOOKUP_ PK_CLOOKUP_LAB_1         PRIMARY KEY  ENABLED                    
LAB                                                                             
                                                                                
COMMON_LOOKUP_ NN_CLOOKUP_LAB_1         NOT NULL     ENABLED                    
LAB                                                                             
                                                                                
COMMON_LOOKUP_ NN_CLOOKUP_LAB_2         NOT NULL     ENABLED                    
LAB                                                                             
                                                                                
COMMON_LOOKUP_ NN_CLOOKUP_LAB_3         NOT NULL     ENABLED                    
LAB                                                                             
                                                                                
COMMON_LOOKUP_ NN_CLOOKUP_LAB_4         NOT NULL     ENABLED                    
LAB                                                                             
                                                                                
COMMON_LOOKUP_ NN_CLOOKUP_LAB_5         NOT NULL     ENABLED                    
LAB                                                                             
                                                                                
COMMON_LOOKUP_ NN_CLOOKUP_LAB_6         NOT NULL     ENABLED                    
LAB                                                                             
                                                                                
COMMON_LOOKUP_ NN_CLOOKUP_LAB_7         NOT NULL     ENABLED                    
LAB                                                                             
                                                                                
COMMON_LOOKUP_ FK_CLOOKUP_LAB_1         FOREIGN KEY  DISABLED                   
LAB                                                                             
                                                                                
COMMON_LOOKUP_ FK_CLOOKUP_LAB_2         FOREIGN KEY  DISABLED                   
LAB                                                                             
                                                                                

10 rows selected.

SQL> 
SQL> -- --------------------------------------------------------
SQL> --  Step #5
SQL> --  -------
SQL> --  Insert data set for preseeded common_lookup_lab table.
SQL> -- --------------------------------------------------------
SQL> INSERT INTO common_lookup_lab
  2  ( common_lookup_lab_id
  3  , common_lookup_lab_context
  4  , common_lookup_lab_type
  5  , common_lookup_lab_meaning
  6  , created_by
  7  , creation_date
  8  , last_updated_by
  9  , last_update_date )
 10   VALUES
 11  ( 1			   -- common_lookup_lab_id
 12  ,'SYSTEM_USER_LAB' 	   -- common_lookup_lab_context
 13  ,'SYSTEM_ADMIN'		   -- common_lookup_lab_type
 14  ,'System Administrator'	   -- common_lookup_lab_meaning
 15  , 1			   -- created_by
 16  , SYSDATE			   -- creation_date
 17  , 1			   -- last_updated_by
 18  , SYSDATE			   -- last_update_date
 19  );

1 row created.

SQL> 
SQL> INSERT INTO common_lookup_lab
  2  ( common_lookup_lab_id
  3  , common_lookup_lab_context
  4  , common_lookup_lab_type
  5  , common_lookup_lab_meaning
  6  , created_by
  7  , creation_date
  8  , last_updated_by
  9  , last_update_date )
 10  VALUES
 11  ( 2			   -- common_lookup_lab_id
 12  ,'SYSTEM_USER_LAB' 	       -- common_lookup_lab_context
 13  ,'DBA'			   -- common_lookup_lab_type
 14  ,'Database Administrator'	   -- common_lookup_lab_meaning
 15  , 1			   -- created_by
 16  , SYSDATE			   -- creation_date
 17  , 1			   -- last_updated_by
 18  , SYSDATE			   -- last_update_date
 19  );

1 row created.

SQL> 
SQL> INSERT INTO common_lookup_lab
  2  ( common_lookup_lab_id
  3  , common_lookup_lab_context
  4  , common_lookup_lab_type
  5  , common_lookup_lab_meaning
  6  , created_by
  7  , creation_date
  8  , last_updated_by
  9  , last_update_date )
 10   VALUES
 11  ( 3			   -- common_lookup_lab_id
 12  ,'SYSTEM_USER_LAB' 	       -- common_lookup_lab_context
 13  ,'SYSTEM_GROUP'		   -- common_lookup_lab_type
 14  ,'System Group'		  -- common_lookup_lab_meaning
 15  , 1			   -- created_by
 16  , SYSDATE			   -- creation_date
 17  , 1			   -- last_updated_by
 18  , SYSDATE			   -- last_update_date
 19  );

1 row created.

SQL> 
SQL> INSERT INTO common_lookup_lab
  2  ( common_lookup_lab_id
  3  , common_lookup_lab_context
  4  , common_lookup_lab_type
  5  , common_lookup_lab_meaning
  6  , created_by
  7  , creation_date
  8  , last_updated_by
  9  , last_update_date )
 10   VALUES
 11  ( 4			   -- common_lookup_lab_id
 12  ,'SYSTEM_USER_LAB' 	       -- common_lookup_lab_context
 13  ,'COST_CENTER'		   -- common_lookup_lab_type
 14  ,'Cost Center'		   -- common_lookup_lab_meaning
 15  , 1			   -- created_by
 16  , SYSDATE			   -- creation_date
 17  , 1			   -- last_updated_by
 18  , SYSDATE			   -- last_update_date
 19  );

1 row created.

SQL> 
SQL> INSERT INTO common_lookup_lab
  2  ( common_lookup_lab_id
  3  , common_lookup_lab_context
  4  , common_lookup_lab_type
  5  , common_lookup_lab_meaning
  6  , created_by
  7  , creation_date
  8  , last_updated_by
  9  , last_update_date )
 10   VALUES
 11  ( 5			   -- common_lookup_lab_id
 12  ,'SYSTEM_USER_LAB' 	       -- common_lookup_lab_context
 13  ,'INDIVIDUAL'		   -- common_lookup_lab_type
 14  ,'Individual'		   -- common_lookup_lab_meaning
 15  , 1			   -- created_by
 16  , SYSDATE			   -- creation_date
 17  , 1			   -- last_updated_by
 18  , SYSDATE			   -- last_update_date
 19  );

1 row created.

SQL> 
SQL> INSERT INTO common_lookup_lab
  2  ( common_lookup_lab_id
  3  , common_lookup_lab_context
  4  , common_lookup_lab_type
  5  , common_lookup_lab_meaning
  6  , created_by
  7  , creation_date
  8  , last_updated_by
  9  , last_update_date )
 10  VALUES
 11  ( common_lookup_lab_s1.nextval    -- common_lookup_lab_id (1001)
 12  ,'CONTACT_LAB'		       -- common_lookup_lab_context
 13  ,'EMPLOYEE'		   -- common_lookup_lab_type
 14  ,'Employee'		   -- common_lookup_lab_meaning
 15  , 1			   -- created_by
 16  , SYSDATE			   -- creation_date
 17  , 1			   -- last_updated_by
 18  , SYSDATE			   -- last_update_date
 19  );

1 row created.

SQL> 
SQL> INSERT INTO common_lookup_lab
  2  ( common_lookup_lab_id
  3  , common_lookup_lab_context
  4  , common_lookup_lab_type
  5  , common_lookup_lab_meaning
  6  , created_by
  7  , creation_date
  8  , last_updated_by
  9  , last_update_date )
 10  VALUES
 11  ( common_lookup_lab_s1.nextval    -- common_lookup_lab_id (1002)
 12  ,'CONTACT_LAB'		       -- common_lookup_lab_context
 13  ,'CUSTOMER'		   -- common_lookup_lab_type
 14  ,'Customer'		   -- common_lookup_lab_meaning
 15  , 1			   -- created_by
 16  , SYSDATE			   -- creation_date
 17  , 1			   -- last_updated_by
 18  , SYSDATE			   -- last_update_date
 19  );

1 row created.

SQL> 
SQL> INSERT INTO common_lookup_lab
  2  ( common_lookup_lab_id
  3  , common_lookup_lab_context
  4  , common_lookup_lab_type
  5  , common_lookup_lab_meaning
  6  , created_by
  7  , creation_date
  8  , last_updated_by
  9  , last_update_date )
 10  VALUES
 11  ( common_lookup_lab_s1.nextval    -- common_lookup_lab_id (1003)
 12  ,'MEMBER_LAB'		       -- common_lookup_lab_context
 13  ,'INDIVIDUAL'		   -- common_lookup_lab_type
 14  ,'Individual Membership'	   -- common_lookup_lab_meaning
 15  , 1			   -- created_by
 16  , SYSDATE			   -- creation_date
 17  , 1			   -- last_updated_by
 18  , SYSDATE			   -- last_update_date
 19  );

1 row created.

SQL> 
SQL> INSERT INTO common_lookup_lab
  2  ( common_lookup_lab_id
  3  , common_lookup_lab_context
  4  , common_lookup_lab_type
  5  , common_lookup_lab_meaning
  6  , created_by
  7  , creation_date
  8  , last_updated_by
  9  , last_update_date )
 10  VALUES
 11  ( common_lookup_lab_s1.nextval    -- common_lookup_lab_id (1004)
 12  ,'MEMBER_LAB'		       -- common_lookup_lab_context
 13  ,'GROUP'			   -- common_lookup_lab_type
 14  ,'Group Membership'	   -- common_lookup_lab_meaning
 15  , 1			   -- created_by
 16  , SYSDATE			   -- creation_date
 17  , 1			   -- last_updated_by
 18  , SYSDATE			   -- last_update_date
 19  );

1 row created.

SQL> 
SQL> INSERT INTO common_lookup_lab
  2  ( common_lookup_lab_id
  3  , common_lookup_lab_context
  4  , common_lookup_lab_type
  5  , common_lookup_lab_meaning
  6  , created_by
  7  , creation_date
  8  , last_updated_by
  9  , last_update_date )
 10  VALUES
 11  ( common_lookup_lab_s1.nextval    -- common_lookup_lab_id (1005)
 12  ,'MEMBER_LAB'		       -- common_lookup_lab_context
 13  ,'DISCOVER_CARD'		   -- common_lookup_lab_type
 14  ,'Discover Card'		   -- common_lookup_lab_meaning
 15  , 1			   -- created_by
 16  , SYSDATE			   -- creation_date
 17  , 1			   -- last_updated_by
 18  , SYSDATE			   -- last_update_date
 19  );

1 row created.

SQL> 
SQL> INSERT INTO common_lookup_lab
  2  ( common_lookup_lab_id
  3  , common_lookup_lab_context
  4  , common_lookup_lab_type
  5  , common_lookup_lab_meaning
  6  , created_by
  7  , creation_date
  8  , last_updated_by
  9  , last_update_date )
 10  VALUES
 11  ( common_lookup_lab_s1.nextval    -- common_lookup_lab_id (1006)
 12  ,'MEMBER_LAB'		       -- common_lookup_lab_context
 13  ,'MASTER_CARD'		   -- common_lookup_lab_type
 14  ,'Master Card'		   -- common_lookup_lab_meaning
 15  , 1			   -- created_by
 16  , SYSDATE			   -- creation_date
 17  , 1			   -- last_updated_by
 18  , SYSDATE			   -- last_update_date
 19  );

1 row created.

SQL> 
SQL> INSERT INTO common_lookup_lab
  2  ( common_lookup_lab_id
  3  , common_lookup_lab_context
  4  , common_lookup_lab_type
  5  , common_lookup_lab_meaning
  6  , created_by
  7  , creation_date
  8  , last_updated_by
  9  , last_update_date )
 10  VALUES
 11  ( common_lookup_lab_s1.nextval    -- common_lookup_lab_id (1007)
 12  ,'MEMBER_LAB'		       -- common_lookup_lab_context
 13  ,'VISA_CARD'		   -- common_lookup_lab_type
 14  ,'Visa Card'		   -- common_lookup_lab_meaning
 15  , 1			   -- created_by
 16  , SYSDATE			   -- creation_date
 17  , 1			   -- last_updated_by
 18  , SYSDATE			   -- last_update_date
 19  );

1 row created.

SQL> 
SQL> INSERT INTO common_lookup_lab
  2  ( common_lookup_lab_id
  3  , common_lookup_lab_context
  4  , common_lookup_lab_type
  5  , common_lookup_lab_meaning
  6  , created_by
  7  , creation_date
  8  , last_updated_by
  9  , last_update_date )
 10  VALUES
 11  ( common_lookup_lab_s1.nextval    -- common_lookup_lab_id (1008)
 12  ,'MULTIPLE'		   -- common_lookup_lab_context
 13  ,'HOME'			   -- common_lookup_lab_type
 14  ,'Home'			   -- common_lookup_lab_meaning
 15  , 1			   -- created_by
 16  , SYSDATE			   -- creation_date
 17  , 1			   -- last_updated_by
 18  , SYSDATE			   -- last_update_date
 19  );

1 row created.

SQL> 
SQL> INSERT INTO common_lookup_lab
  2  ( common_lookup_lab_id
  3  , common_lookup_lab_context
  4  , common_lookup_lab_type
  5  , common_lookup_lab_meaning
  6  , created_by
  7  , creation_date
  8  , last_updated_by
  9  , last_update_date )
 10  VALUES
 11  ( common_lookup_lab_s1.nextval    -- common_lookup_lab_id (1009)
 12  ,'MULTIPLE'		   -- common_lookup_lab_context
 13  ,'WORK'			   -- common_lookup_lab_type
 14  ,'Work'			   -- common_lookup_lab_meaning
 15  , 1			   -- created_by
 16  , SYSDATE			   -- creation_date
 17  , 1			   -- last_updated_by
 18  , SYSDATE			   -- last_update_date
 19  );

1 row created.

SQL> 
SQL> INSERT INTO common_lookup_lab
  2  ( common_lookup_lab_id
  3  , common_lookup_lab_context
  4  , common_lookup_lab_type
  5  , common_lookup_lab_meaning
  6  , created_by
  7  , creation_date
  8  , last_updated_by
  9  , last_update_date )
 10  VALUES
 11  ( common_lookup_lab_s1.nextval    -- common_lookup_lab_id (1010)
 12  ,'ITEM_LAB'		       -- common_lookup_lab_context
 13  ,'DVD_FULL_SCREEN' 	   -- common_lookup_lab_type
 14  ,'DVD: Full Screen'	   -- common_lookup_lab_meaning
 15  , 1			   -- created_by
 16  , SYSDATE			   -- creation_date
 17  , 1			   -- last_updated_by
 18  , SYSDATE			   -- last_update_date
 19  );

1 row created.

SQL> 
SQL> INSERT INTO common_lookup_lab
  2  ( common_lookup_lab_id
  3  , common_lookup_lab_context
  4  , common_lookup_lab_type
  5  , common_lookup_lab_meaning
  6  , created_by
  7  , creation_date
  8  , last_updated_by
  9  , last_update_date )
 10  VALUES
 11  ( common_lookup_lab_s1.nextval    -- common_lookup_lab_id (1011)
 12  ,'ITEM_LAB'		       -- common_lookup_lab_context
 13  ,'DVD_WIDE_SCREEN' 	   -- common_lookup_lab_type
 14  ,'DVD: Wide Screen'	   -- common_lookup_lab_meaning
 15  , 1			   -- created_by
 16  , SYSDATE			   -- creation_date
 17  , 1			   -- last_updated_by
 18  , SYSDATE			   -- last_update_date
 19  );

1 row created.

SQL> 
SQL> INSERT INTO common_lookup_lab
  2  ( common_lookup_lab_id
  3  , common_lookup_lab_context
  4  , common_lookup_lab_type
  5  , common_lookup_lab_meaning
  6  , created_by
  7  , creation_date
  8  , last_updated_by
  9  , last_update_date )
 10  VALUES
 11  ( common_lookup_lab_s1.nextval    -- common_lookup_lab_id (1012)
 12  ,'ITEM_LAB'		       -- common_lookup_lab_context
 13  ,'NINTENDO_GAMECUBE'	   -- common_lookup_lab_type
 14  ,'Nintendo Gamecube'	   -- common_lookup_lab_meaning
 15  , 1			   -- created_by
 16  , SYSDATE			   -- creation_date
 17  , 1			   -- last_updated_by
 18  , SYSDATE			   -- last_update_date
 19  );

1 row created.

SQL> 
SQL> INSERT INTO common_lookup_lab
  2  ( common_lookup_lab_id
  3  , common_lookup_lab_context
  4  , common_lookup_lab_type
  5  , common_lookup_lab_meaning
  6  , created_by
  7  , creation_date
  8  , last_updated_by
  9  , last_update_date )
 10  VALUES
 11  ( common_lookup_lab_s1.nextval    -- common_lookup_lab_id (1013)
 12  ,'ITEM_LAB'		       -- common_lookup_lab_context
 13  ,'PLAYSTATION2'		   -- common_lookup_lab_type
 14  ,'Playstation2'		   -- common_lookup_lab_meaning
 15  , 1			   -- created_by
 16  , SYSDATE			   -- creation_date
 17  , 1			   -- last_updated_by
 18  , SYSDATE			   -- last_update_date
 19  );

1 row created.

SQL> 
SQL> INSERT INTO common_lookup_lab
  2  ( common_lookup_lab_id
  3  , common_lookup_lab_context
  4  , common_lookup_lab_type
  5  , common_lookup_lab_meaning
  6  , created_by
  7  , creation_date
  8  , last_updated_by
  9  , last_update_date )
 10  VALUES
 11  ( common_lookup_lab_s1.nextval    -- common_lookup_lab_id (1014)
 12  ,'ITEM_LAB'		       -- common_lookup_lab_context
 13  ,'XBOX'			   -- common_lookup_lab_type
 14  ,'XBOX'			   -- common_lookup_lab_meaning
 15  , 1			   -- created_by
 16  , SYSDATE			   -- creation_date
 17  , 1			   -- last_updated_by
 18  , SYSDATE			   -- last_update_date
 19  );

1 row created.

SQL> 
SQL> INSERT INTO common_lookup_lab
  2  ( common_lookup_lab_id
  3  , common_lookup_lab_context
  4  , common_lookup_lab_type
  5  , common_lookup_lab_meaning
  6  , created_by
  7  , creation_date
  8  , last_updated_by
  9  , last_update_date )
 10  VALUES
 11  ( common_lookup_lab_s1.nextval    -- common_lookup_lab_id (1011)
 12  ,'ITEM_LAB'		       -- common_lookup_lab_context
 13  ,'BLU-RAY' 		   -- common_lookup_lab_type
 14  ,'Blu-ray' 		   -- common_lookup_lab_meaning
 15  , 1			   -- created_by
 16  , SYSDATE			   -- creation_date
 17  , 1			   -- last_updated_by
 18  , SYSDATE			   -- last_update_date
 19  );

1 row created.

SQL> 
SQL> -- --------------------------------------------------------
SQL> --  Step #6
SQL> --  -------
SQL> --  Display the preseeded values in the common_lookup_lab table.
SQL> -- --------------------------------------------------------
SQL> COL common_lookup_lab_id	    FORMAT  9999
SQL> COL common_lookup_lab_context  FORMAT A22
SQL> COL common_lookup_lab_type     FORMAT A16
SQL> SELECT   common_lookup_lab_id
  2  ,	      common_lookup_lab_context
  3  ,	      common_lookup_lab_type
  4  FROM     common_lookup_lab;

COMMON_LOOKUP_LAB_ID COMMON_LOOKUP_LAB_CONT COMMON_LOOKUP_LA                    
-------------------- ---------------------- ----------------                    
                   1 SYSTEM_USER_LAB        SYSTEM_ADMIN                        
                   2 SYSTEM_USER_LAB        DBA                                 
                   3 SYSTEM_USER_LAB        SYSTEM_GROUP                        
                   4 SYSTEM_USER_LAB        COST_CENTER                         
                   5 SYSTEM_USER_LAB        INDIVIDUAL                          
                1001 CONTACT_LAB            EMPLOYEE                            
                1002 CONTACT_LAB            CUSTOMER                            
                1003 MEMBER_LAB             INDIVIDUAL                          
                1004 MEMBER_LAB             GROUP                               
                1005 MEMBER_LAB             DISCOVER_CARD                       
                1006 MEMBER_LAB             MASTER_CARD                         
                1007 MEMBER_LAB             VISA_CARD                           
                1008 MULTIPLE               HOME                                
                1009 MULTIPLE               WORK                                
                1010 ITEM_LAB               DVD_FULL_SCREEN                     
                1011 ITEM_LAB               DVD_WIDE_SCREEN                     
                1012 ITEM_LAB               NINTENDO_GAMECUB                    
                                            E                                   
                                                                                
                1013 ITEM_LAB               PLAYSTATION2                        
                1014 ITEM_LAB               XBOX                                
                1015 ITEM_LAB               BLU-RAY                             

20 rows selected.

SQL> 
SQL> -- --------------------------------------------------------
SQL> --  Step #7
SQL> --  -------
SQL> --  Write two queries using the COMMON_LOOKUP_LAB table:
SQL> --  --------------------------------------------------
SQL> --   One finds the primary key values for the
SQL> --   SYSTEM_USER_LAB_GROUP_ID in the COMMON_LOOKUP_LAB table.
SQL> --   Another finds the primary key values for the
SQL> --   SYSTEM_USER_LAB_TYPE in the COMMON_LOOKUP_LAB table.
SQL> --  --------------------------------------------------
SQL> --  Both queries use the COMMON_LOOKUP_LAB_CONTEXT and
SQL> --  COMMON_LOOKUP_LAB_TYPE columns.
SQL> -- --------------------------------------------------------
SQL> SELECT   common_lookup_lab_id
  2  FROM     common_lookup_lab
  3  WHERE    common_lookup_lab_context = 'SYSTEM_USER_LAB'
  4  AND      common_lookup_lab_type = 'SYSTEM_GROUP';

COMMON_LOOKUP_LAB_ID                                                            
--------------------                                                            
                   3                                                            

1 row selected.

SQL> 
SQL> SELECT   common_lookup_lab_id
  2  FROM     common_lookup_lab
  3  WHERE    common_lookup_lab_context = 'SYSTEM_USER_LAB'
  4  AND      common_lookup_lab_type = 'SYSTEM_ADMIN';

COMMON_LOOKUP_LAB_ID                                                            
--------------------                                                            
                   1                                                            

1 row selected.

SQL> 
SQL> -- --------------------------------------------------------
SQL> --  Step #8
SQL> --  -------
SQL> --  Update the SYSTEM_USER_LAB_GROUP_ID and SYSTEM_USER_LAB_TYPE
SQL> --  columns in the SYSTEM_USER_LAB table.
SQL> -- --------------------------------------------------------
SQL> UPDATE system_user_lab
  2  SET    system_user_lab_group_id =
  3  	      (SELECT	common_lookup_lab_id
  4  	       FROM	common_lookup_lab
  5  	       WHERE	common_lookup_lab_context = 'SYSTEM_USER_LAB'
  6  	       AND	common_lookup_lab_type = 'SYSTEM_ADMIN')
  7  WHERE  system_user_lab_id = 1;

1 row updated.

SQL> 
SQL> -- Display results.
SQL> SET NULL '<Null>'
SQL> COL system_user_lab_id	   FORMAT 999999  HEADING "System|User|ID #"
SQL> COL system_user_lab_name	   FORMAT A10	  HEADING "System|User|Name"
SQL> COL system_user_lab_group_id  FORMAT 999999  HEADING "System|User|Group|ID #"
SQL> COL system_user_lab_type	   FORMAT 999999  HEADING "System|User|Type"
SQL> SELECT   system_user_lab_id
  2  ,	      system_user_lab_name
  3  ,	      system_user_lab_group_id
  4  ,	      system_user_lab_type
  5  FROM     system_user_lab
  6  WHERE    system_user_lab_id = 1;

                    System                                                      
 System System        User  System                                              
   User User         Group    User                                              
   ID # Name          ID #    Type                                              
------- ---------- ------- -------                                              
      1 SYSADMIN         1 <Null>                                               

1 row selected.

SQL> 
SQL> UPDATE system_user_lab
  2  SET    system_user_lab_type =
  3  	      (SELECT	common_lookup_lab_id
  4  	       FROM	common_lookup_lab
  5  	       WHERE	common_lookup_lab_context = 'SYSTEM_USER_LAB'
  6  	       AND	common_lookup_lab_type = 'SYSTEM_GROUP')
  7  WHERE  system_user_lab_id = 1;

1 row updated.

SQL> 
SQL> -- Display results.
SQL> SET NULL '<Null>'
SQL> COL system_user_lab_id	   FORMAT 999999  HEADING "System|User|ID #"
SQL> COL system_user_lab_name	   FORMAT A10	  HEADING "System|User|Name"
SQL> COL system_user_lab_group_id  FORMAT 999999  HEADING "System|User|Group|ID #"
SQL> COL system_user_lab_type	   FORMAT 999999  HEADING "System|User|Type"
SQL> SELECT   system_user_lab_id
  2  ,	      system_user_lab_name
  3  ,	      system_user_lab_group_id
  4  ,	      system_user_lab_type
  5  FROM     system_user_lab
  6  WHERE    system_user_lab_id = 1;

                    System                                                      
 System System        User  System                                              
   User User         Group    User                                              
   ID # Name          ID #    Type                                              
------- ---------- ------- -------                                              
      1 SYSADMIN         1       3                                              

1 row selected.

SQL> 
SQL> -- --------------------------------------------------------
SQL> --  Step #9
SQL> --  --------
SQL> --  Enable foreign key constraints dependencies.
SQL> -- --------------------------------------------------------
SQL> -- Enable fk_system_user_lab_3 constraint.
SQL> ALTER TABLE system_user_lab
  2    ENABLE CONSTRAINT fk_system_user_lab_3;

Table altered.

SQL> 
SQL> -- Enable fk_system_user_lab_4 constraint.
SQL> ALTER TABLE system_user_lab
  2    ENABLE CONSTRAINT fk_system_user_lab_4;

Table altered.

SQL> 
SQL> -- Display system_user_lab table constraints.
SQL> COL table_name	  FORMAT A14  HEADING "Table Name"
SQL> COL constraint_name  FORMAT A24  HEADING "Constraint Name"
SQL> COL constraint_type  FORMAT A12  HEADING "Constraint Type"
SQL> COL status 	  FORMAT A8   HEADING "Status"
SQL> SELECT   table_name
  2  ,	      constraint_name
  3  ,	      CASE
  4  		WHEN constraint_type = 'R'	  THEN 'FOREIGN KEY'
  5  		WHEN constraint_type = 'P'	  THEN 'PRIMARY KEY'
  6  		WHEN constraint_type = 'U'	  THEN 'UNIQUE'
  7  		WHEN constraint_type = 'C' AND	REGEXP_LIKE(constraint_name,'^.*nn.*$','i')
  8  		THEN 'NOT NULL'
  9  		ELSE 'CHECK'
 10  	      END constraint_type
 11  ,	      status
 12  FROM     user_constraints
 13  WHERE    table_name = 'SYSTEM_USER_LAB'
 14  ORDER BY CASE
 15  		WHEN constraint_type = 'PRIMARY KEY' THEN 1
 16  		WHEN constraint_type = 'NOT NULL'    THEN 2
 17  		WHEN constraint_type = 'CHECK'	     THEN 3
 18  		WHEN constraint_type = 'UNIQUE'      THEN 4
 19  		WHEN constraint_type = 'FOREIGN KEY' THEN 5
 20  	      END
 21  ,	      constraint_name;

Table Name     Constraint Name          Constraint T Status                     
-------------- ------------------------ ------------ --------                   
SYSTEM_USER_LA PK_SYSTEM_USER_LAB_1     PRIMARY KEY  ENABLED                    
B                                                                               
                                                                                
SYSTEM_USER_LA NN_SYSTEM_USER_LAB_1     NOT NULL     ENABLED                    
B                                                                               
                                                                                
SYSTEM_USER_LA NN_SYSTEM_USER_LAB_4     NOT NULL     ENABLED                    
B                                                                               
                                                                                
SYSTEM_USER_LA NN_SYSTEM_USER_LAB_5     NOT NULL     ENABLED                    
B                                                                               
                                                                                
SYSTEM_USER_LA NN_SYSTEM_USER_LAB_6     NOT NULL     ENABLED                    
B                                                                               
                                                                                
SYSTEM_USER_LA NN_SYSTEM_USER_LAB_7     NOT NULL     ENABLED                    
B                                                                               
                                                                                
SYSTEM_USER_LA FK_SYSTEM_USER_LAB_1     FOREIGN KEY  ENABLED                    
B                                                                               
                                                                                
SYSTEM_USER_LA FK_SYSTEM_USER_LAB_2     FOREIGN KEY  ENABLED                    
B                                                                               
                                                                                
SYSTEM_USER_LA FK_SYSTEM_USER_LAB_3     FOREIGN KEY  ENABLED                    
B                                                                               
                                                                                
SYSTEM_USER_LA FK_SYSTEM_USER_LAB_4     FOREIGN KEY  ENABLED                    
B                                                                               
                                                                                

10 rows selected.

SQL> 
SQL> -- Enable fk_clookup_lab_1 constraint.
SQL> ALTER TABLE common_lookup_lab
  2    ENABLE CONSTRAINT fk_clookup_lab_1;

Table altered.

SQL> 
SQL> -- Enable fk_clookup_lab_2 constraint.
SQL> ALTER TABLE common_lookup_lab
  2    ENABLE CONSTRAINT fk_clookup_lab_2;

Table altered.

SQL> 
SQL> -- Display system_user_lab table constraints.
SQL> COL table_name	  FORMAT A14  HEADING "Table Name"
SQL> COL constraint_name  FORMAT A24  HEADING "Constraint Name"
SQL> COL constraint_type  FORMAT A12  HEADING "Constraint Type"
SQL> COL status 	  FORMAT A8   HEADING "Status"
SQL> SELECT   table_name
  2  ,	      constraint_name
  3  ,	      CASE
  4  		WHEN constraint_type = 'R'	  THEN 'FOREIGN KEY'
  5  		WHEN constraint_type = 'P'	  THEN 'PRIMARY KEY'
  6  		WHEN constraint_type = 'U'	  THEN 'UNIQUE'
  7  		WHEN constraint_type = 'C' AND	REGEXP_LIKE(constraint_name,'^.*nn.*$','i')
  8  		THEN 'NOT NULL'
  9  		ELSE 'CHECK'
 10  	      END constraint_type
 11  ,	      status
 12  FROM     user_constraints
 13  WHERE    table_name = 'COMMON_LOOKUP_LAB'
 14  ORDER BY CASE
 15  		WHEN constraint_type = 'PRIMARY KEY' THEN 1
 16  		WHEN constraint_type = 'NOT NULL'    THEN 2
 17  		WHEN constraint_type = 'CHECK'	     THEN 3
 18  		WHEN constraint_type = 'UNIQUE'      THEN 4
 19  		WHEN constraint_type = 'FOREIGN KEY' THEN 5
 20  	      END
 21  ,	      constraint_name;

Table Name     Constraint Name          Constraint T Status                     
-------------- ------------------------ ------------ --------                   
COMMON_LOOKUP_ PK_CLOOKUP_LAB_1         PRIMARY KEY  ENABLED                    
LAB                                                                             
                                                                                
COMMON_LOOKUP_ NN_CLOOKUP_LAB_1         NOT NULL     ENABLED                    
LAB                                                                             
                                                                                
COMMON_LOOKUP_ NN_CLOOKUP_LAB_2         NOT NULL     ENABLED                    
LAB                                                                             
                                                                                
COMMON_LOOKUP_ NN_CLOOKUP_LAB_3         NOT NULL     ENABLED                    
LAB                                                                             
                                                                                
COMMON_LOOKUP_ NN_CLOOKUP_LAB_4         NOT NULL     ENABLED                    
LAB                                                                             
                                                                                
COMMON_LOOKUP_ NN_CLOOKUP_LAB_5         NOT NULL     ENABLED                    
LAB                                                                             
                                                                                
COMMON_LOOKUP_ NN_CLOOKUP_LAB_6         NOT NULL     ENABLED                    
LAB                                                                             
                                                                                
COMMON_LOOKUP_ NN_CLOOKUP_LAB_7         NOT NULL     ENABLED                    
LAB                                                                             
                                                                                
COMMON_LOOKUP_ FK_CLOOKUP_LAB_1         FOREIGN KEY  ENABLED                    
LAB                                                                             
                                                                                
COMMON_LOOKUP_ FK_CLOOKUP_LAB_2         FOREIGN KEY  ENABLED                    
LAB                                                                             
                                                                                

10 rows selected.

SQL> 
SQL> -- --------------------------------------------------------
SQL> --  Step #10
SQL> --  --------
SQL> --  Alter the table to add not null constraints.
SQL> -- --------------------------------------------------------
SQL> ALTER TABLE system_user_lab
  2    MODIFY (system_user_lab_group_id  NUMBER  CONSTRAINT nn_system_user_lab_2 NOT NULL);

Table altered.

SQL> 
SQL> ALTER TABLE system_user_lab
  2    MODIFY (system_user_lab_type	 NUMBER  CONSTRAINT nn_system_user_lab_3 NOT NULL);

Table altered.

SQL> 
SQL> -- Display system_user_lab table constraints.
SQL> COL table_name	  FORMAT A14  HEADING "Table Name"
SQL> COL constraint_name  FORMAT A24  HEADING "Constraint Name"
SQL> COL constraint_type  FORMAT A12  HEADING "Constraint Type"
SQL> COL status 	  FORMAT A8   HEADING "Status"
SQL> SELECT   table_name
  2  ,	      constraint_name
  3  ,	      CASE
  4  		WHEN constraint_type = 'R'	  THEN 'FOREIGN KEY'
  5  		WHEN constraint_type = 'P'	  THEN 'PRIMARY KEY'
  6  		WHEN constraint_type = 'U'	  THEN 'UNIQUE'
  7  		WHEN constraint_type = 'C' AND	REGEXP_LIKE(constraint_name,'^.*nn.*$','i')
  8  		THEN 'NOT NULL'
  9  		ELSE 'CHECK'
 10  	      END constraint_type
 11  ,	      status
 12  FROM     user_constraints
 13  WHERE    table_name = 'SYSTEM_USER_LAB'
 14  ORDER BY CASE
 15  		WHEN constraint_type = 'PRIMARY KEY' THEN 1
 16  		WHEN constraint_type = 'NOT NULL'    THEN 2
 17  		WHEN constraint_type = 'CHECK'	     THEN 3
 18  		WHEN constraint_type = 'UNIQUE'      THEN 4
 19  		WHEN constraint_type = 'FOREIGN KEY' THEN 5
 20  	      END
 21  ,	      constraint_name;

Table Name     Constraint Name          Constraint T Status                     
-------------- ------------------------ ------------ --------                   
SYSTEM_USER_LA PK_SYSTEM_USER_LAB_1     PRIMARY KEY  ENABLED                    
B                                                                               
                                                                                
SYSTEM_USER_LA NN_SYSTEM_USER_LAB_1     NOT NULL     ENABLED                    
B                                                                               
                                                                                
SYSTEM_USER_LA NN_SYSTEM_USER_LAB_2     NOT NULL     ENABLED                    
B                                                                               
                                                                                
SYSTEM_USER_LA NN_SYSTEM_USER_LAB_3     NOT NULL     ENABLED                    
B                                                                               
                                                                                
SYSTEM_USER_LA NN_SYSTEM_USER_LAB_4     NOT NULL     ENABLED                    
B                                                                               
                                                                                
SYSTEM_USER_LA NN_SYSTEM_USER_LAB_5     NOT NULL     ENABLED                    
B                                                                               
                                                                                
SYSTEM_USER_LA NN_SYSTEM_USER_LAB_6     NOT NULL     ENABLED                    
B                                                                               
                                                                                
SYSTEM_USER_LA NN_SYSTEM_USER_LAB_7     NOT NULL     ENABLED                    
B                                                                               
                                                                                
SYSTEM_USER_LA FK_SYSTEM_USER_LAB_1     FOREIGN KEY  ENABLED                    
B                                                                               
                                                                                
SYSTEM_USER_LA FK_SYSTEM_USER_LAB_2     FOREIGN KEY  ENABLED                    
B                                                                               
                                                                                
SYSTEM_USER_LA FK_SYSTEM_USER_LAB_3     FOREIGN KEY  ENABLED                    
B                                                                               
                                                                                
SYSTEM_USER_LA FK_SYSTEM_USER_LAB_4     FOREIGN KEY  ENABLED                    
B                                                                               
                                                                                

12 rows selected.

SQL> 
SQL> -- --------------------------------------------------------
SQL> --  Step #11
SQL> --  --------
SQL> --  Insert row in the system_user_lab table with subqueries.
SQL> -- --------------------------------------------------------
SQL> INSERT INTO system_user_lab
  2  ( system_user_lab_id
  3  , system_user_lab_name
  4  , system_user_lab_group_id
  5  , system_user_lab_type
  6  , first_name
  7  , middle_name
  8  , last_name
  9  , created_by
 10  , creation_date
 11  , last_updated_by
 12  , last_update_date)
 13  VALUES
 14  ( system_user_lab_s1.NEXTVAL			   -- system_user_lab_id
 15  ,'DBA1'					       -- system_user_lab_name
 16  ,(SELECT	common_lookup_lab_id
 17    FROM	common_lookup_lab
 18    WHERE	common_lookup_lab_context = 'SYSTEM_USER_LAB'
 19    AND	common_lookup_lab_type = 'DBA') 	   -- system_user_lab_group_id
 20  ,(SELECT	common_lookup_lab_id
 21    FROM	common_lookup_lab
 22    WHERE	common_lookup_lab_context = 'SYSTEM_USER_LAB'
 23    AND	common_lookup_lab_type = 'SYSTEM_GROUP')   -- system_user_lab_type
 24  ,'Phineas'
 25  ,'Taylor'
 26  ,'Barnum'
 27  ,(SELECT	system_user_lab_id
 28    FROM	system_user_lab
 29    WHERE	system_user_lab_name = 'SYSADMIN')	   -- created_by
 30  , SYSDATE					       -- creation_date
 31  ,(SELECT	system_user_lab_id
 32    FROM	system_user_lab
 33    WHERE	system_user_lab_name = 'SYSADMIN')	   -- last_updated_by
 34  , SYSDATE					       -- last_update_date
 35  );

1 row created.

SQL> 
SQL> INSERT INTO system_user_lab
  2  ( system_user_lab_id
  3  , system_user_lab_name
  4  , system_user_lab_group_id
  5  , system_user_lab_type
  6  , first_name
  7  , last_name
  8  , created_by
  9  , creation_date
 10  , last_updated_by
 11  , last_update_date)
 12  VALUES
 13  ( system_user_lab_s1.NEXTVAL			   -- system_user_lab_id
 14  ,'DBA2'					       -- system_user_lab_name
 15  ,(SELECT	common_lookup_lab_id
 16    FROM	common_lookup_lab
 17    WHERE	common_lookup_lab_context = 'SYSTEM_USER_LAB'
 18    AND	common_lookup_lab_type = 'DBA') 	   -- system_user_lab_group_id
 19  ,(SELECT	common_lookup_lab_id
 20    FROM	common_lookup_lab
 21    WHERE	common_lookup_lab_context = 'SYSTEM_USER_LAB'
 22    AND	common_lookup_lab_type = 'SYSTEM_GROUP')   -- system_user_lab_type
 23  ,'Phileas'
 24  ,'Fogg'
 25  ,(SELECT	system_user_lab_id
 26    FROM	system_user_lab
 27    WHERE	system_user_lab_name = 'SYSADMIN')	   -- created_by
 28  , SYSDATE					       -- creation_date
 29  ,(SELECT	system_user_lab_id
 30    FROM	system_user_lab
 31    WHERE	system_user_lab_name = 'SYSADMIN')	   -- last_updated_by
 32  , SYSDATE					       -- last_update_date
 33  );

1 row created.

SQL> 
SQL> -- --------------------------------------------------------
SQL> --  Step #12
SQL> --  --------
SQL> --  Display inserted rows from the system_user_lab table.
SQL> -- --------------------------------------------------------
SQL> SET NULL '<Null>'
SQL> COL system_user_lab_id	   FORMAT  9999
SQL> COL system_user_lab_group_id  FORMAT  9999
SQL> COL system_user_lab_type	   FORMAT  9999
SQL> COL system_user_lab_name	   FORMAT  A10
SQL> COL full_user_name        FORMAT  A30
SQL> SELECT   system_user_lab_id
  2  ,	      system_user_lab_group_id
  3  ,	      system_user_lab_type
  4  ,	      system_user_lab_name
  5  ,	      CASE
  6  		WHEN last_name IS NOT NULL THEN
  7  		  last_name || ', ' || first_name || ' ' || middle_name
  8  	      END AS full_user_name
  9  FROM     system_user_lab;

       System                                                                   
System   User System System                                                     
  User  Group   User User                                                       
  ID #   ID #   Type Name       FULL_USER_NAME                                  
------ ------ ------ ---------- ------------------------------                  
     1      1      3 SYSADMIN   <Null>                                          
  1001      2      3 DBA1       Barnum, Phineas Taylor                          
  1002      2      3 DBA2       Fogg, Phileas                                   

3 rows selected.

SQL> 
SQL> -- Commit changes.
SQL> COMMIT;

Commit complete.

SQL> 
SQL> spool off
